{
  "schema_version": 1,
  "fact_id": "a1000000-0000-4000-8000-000000000001",
  "subject": "crucible.runner.strategy-signal.v1.acme.10000000-0000-4000-8000-000000000001.sandbox",
  "tenant_id": "acme",
  "trading_mode": "sandbox",
  "runner_id": "10000000-0000-4000-8000-000000000001",
  "deployment_instance_id": "20000000-0000-4000-8000-000000000002",
  "deployment_spec_id": "30000000-0000-4000-8000-000000000003",
  "deployment_spec_digest": "aaaaaaaaaaaaaaaaaaaaaaaaaaaaaaaaaaaaaaaaaaaaaaaaaaaaaaaaaaaaaaaa",
  "generation": 7,
  "strategy_id": "40000000-0000-4000-8000-000000000004",
  "capability_version_id": "50000000-0000-4000-8000-000000000005",
  "capability_version": 1,
  "capability_manifest_digest": "bbbbbbbbbbbbbbbbbbbbbbbbbbbbbbbbbbbbbbbbbbbbbbbbbbbbbbbbbbbbbbbb",
  "strategy_version": "trend-v1",
  "instrument": "BTCUSDT-PERP.BINANCE",
  "client_order_id": "O-20261004-001",
  "timeframe": "1-MINUTE",
  "direction": "long",
  "occurred_at": "2026-10-04T01:02:03.632001Z",
  "source_sequence": 1,
  "input_digest": "cccccccccccccccccccccccccccccccccccccccccccccccccccccccccccccccc",
  "trace_id": "a2000000-0000-4000-8000-000000000001",
  "key_id": "ed25519-65b60673d6ed884bf01c2c222d82ada0",
  "signature": "Mrsq26L9pse9WFhtCACDiQKb5bdbkpjtZCdl9Bhi0NSt72OQoxjLmD7VsqmlZnq4JpObd-n3jmTdekgnWlpgDA"
}
